{
  "$schema": "./facade-v1.schema.json",
  "contract": "baldr-facade",
  "version": "1.0.0",
  "product": "baldr-router",
  "description": "Shared client-facade contract. Facades translate UX into setup/status/run and must not reimplement durable routing, execution-profile, provider, workflow, Context7, telemetry, or verification logic.",
  "commandPalette": {
    "primary": "Baldr: Open",
    "maximumVisibleCommands": 1
  },
  "intents": {
    "setup": {
      "title": "Setup",
      "description": "Prepare the runtime, durable state store, lifecycle verification, trusted-workspace profile, execution profiles, providers, and optional Context7 without exposing secrets.",
      "requiresWorkspace": false,
      "requiresTask": false,
      "mcpPrompt": "setup",
      "cli": [
        "facade",
        "setup"
      ],
      "aliases": {
        "vscodeParticipant": "@baldr /setup",
        "vscodeAgentPlugin": "/baldr-setup",
        "kiro": "setup"
      },
      "instruction": "Inspect Baldr Router with router_doctor, router_provider_status, router_workflow_status, router_extension_status, and context7_onboarding. Present a short guided setup, including SQLite durability/schema status, resolved execution profiles, the latest lifecycle evidence, and trusted-workspace profile when available. Never ask for API keys in chat. Keep current profiles unless the user explicitly changes them. Context7 is optional."
    },
    "status": {
      "title": "Status",
      "description": "Return a compact health report for runtime, durable runs/recovery, lifecycle evidence, workspace profile, providers, execution profiles, workflow, Context7, extensions, and recent runs.",
      "requiresWorkspace": false,
      "requiresTask": false,
      "mcpPrompt": "status",
      "cli": [
        "facade",
        "status"
      ],
      "aliases": {
        "vscodeParticipant": "@baldr /status",
        "vscodeAgentPlugin": "/baldr-status",
        "kiro": "status"
      },
      "instruction": "Inspect Baldr Router with router_doctor, router_provider_status, router_workflow_status, router_extension_status, and router_recent_runs. Include SQLite schema/nonterminal/recovery status, resolved execution profiles, the latest redacted lifecycle evidence, and workspace-profile status. Return a concise report with actionable warnings only. Do not modify files."
    },
    "run": {
      "title": "Run",
      "description": "Create, continue, resume, or idempotently reuse the configured durable orchestration workflow for a task in the active workspace.",
      "requiresWorkspace": true,
      "requiresTask": true,
      "mcpPrompt": "run",
      "cli": [
        "facade",
        "run"
      ],
      "aliases": {
        "vscodeParticipant": "@baldr /run <task>",
        "vscodeAgentPlugin": "/baldr-run <task>",
        "kiro": "run"
      },
      "instruction": "Run the configured durable Baldr workflow for the supplied task and workspace. Prefer run_architect_implement_review. Baldr controls provider dialogue and frozen execution-profile snapshots; do not create uncontrolled provider-to-provider recursion. Return run_id, durable status, consolidated structured report, verification performed, blockers, evidence, and follow-up items."
    }
  },
  "facadeRules": [
    "A facade may own client-native onboarding, secure secret storage, UI rendering, and runtime discovery.",
    "A facade must delegate domain decisions to baldr-router through the facade contract, MCP prompts/tools, or the CLI facade.",
    "A facade must not duplicate provider selection, role assignment, workflow execution, Context7 enrichment, telemetry aggregation, or verification rules.",
    "Secrets must remain in client secret storage, an approved environment variable, or the router local secret store; never in a repository or chat transcript.",
    "The visible daily surface should be setup, status, and run. Recovery and diagnostics belong behind the primary open action.",
    "Facades must reuse the core environment probe, workspace profile, lifecycle verifier, and evidence format; they must not implement parallel scanners or self-tests.",
    "Facades must treat SQLite workflow state, recovery classification, and execution-profile resolution as core-owned data; they may render but not recreate it."
  ]
}
